longDBName,shortDBName,an,title,abstract,publicationDate,contributors,docTypes,pubTypes,coverDate,peerReviewed,source,subjects,isiType,doids,isbns,issns,publisherLocations,identifiers,isOpenAccess,bookEdition,language,publisher,pageEnd,pageStart,pageCount,volume,issue,doi,notes,mid,degreeLevel,plink
GreenFILE,8gh,146250325,Antibiotic resistance genes in biofilms on plastic wastes in an estuarine environment.,"Plastic wastes are ubiquitous in aquatic environment. Biofilms, which are often formed on the surface of plastic waste, may contain antibiotic resistance genes (ARGs). This study focused on the occurrence and distribution of ARGs, metal resistance genes (MRGs) and their associated microbial communities in biofilms formed on different types of plastic, in comparison to associated sediment and water samples taken from the Yangtze Estuary. The results showed that polypropylene (PP) and polyethylene (PE) with visible biofilms were highly abundant, and the average absolute abundance of most tested ARGs in the biofilms was higher than that in the sediment and water, indicating that biofilms on plastics can act as a reservoir for ARGs. Moreover, the biofilms on PE had a higher relative abundance of ARGs, compared to those on other plastics, and Firmicutes on PE may be potential hosts for these ARGs. Furthermore, Bacillus , Mycobacterium and Pseudomonas may be multi-resistance genera on plastics, and tet A and tet W may have more potential hosts on PET and PP. Metals, total phosphorus and salinity may be the major environmental factors regulating ARGs in biofilms formed on plastics. The results provide new insights into evaluating the risks caused by plastic wastes and ARGs in biofilms formed on plastics in estuarine environment. Unlabelled Image • ARG absolute abundance showed: biofilms on plastics > sediment > water. • Biofilms formed on PE had a higher relative abundance of ARGs. • Firmicutes showed significant correlations with sul 1 and tet A on PE. • Metals, TP and salinity may regulate the ARGs in biofilms on plastics.",20201125,"Guo, Xing-pan ; Sun, Xiao-li ; Chen, Yu-ru ; Hou, Lijun ; Liu, Min ; Yang, Yi",Article,Academic Journal,Nov2020,true,Science of the Total Environment,,JOUR,,,0048-9697,,,,,eng,Elsevier B.V.,N.PAG,N.PAG,,745,,10.1016/j.scitotenv.2020.140916,,3QW,,https://research.ebsco.com/linkprocessor/plink?id=c4ac44da-99ee-3ef1-a9bc-a2ad7ba58728
GreenFILE,8gh,149015567,Plastisphere enrich antibiotic resistance genes and potential pathogenic bacteria in sewage with pharmaceuticals.,"Microplastics (MPs) and pharmaceuticals are common emerging pollutants in sewage, and their coexistence may have more negative effects on the environments. This study chose tetracycline (TC), ampicillin (AMP) and triclosan (TCS) to investigate the responses of antibiotic resistance genes (ARGs) and microbial communities on different MPs (polyvinyl chloride (PVC), polyethylene (PE)) biofilms (plastisphere). The adsorption capacity of three pharmaceuticals on PVC and PE decreased in the order of AMP > TC > TCS. PE was more conducive to microbial attachment than PVC. MPs led to the increase of the total copies of ARGs and mobile genetic elements (MGEs) in the sewage. Importantly, multidrug ARGs and MGEs were enriched on plastisphere. Furthermore, the co-occurrence of TC and MPs led to higher risks of spreading ARGs and MGEs. In addition, potential pathogenic bacteria Legionella , Mycobacterium , Neisseria and Arcobacter were more abundant on plastisphere than those in sewage, and these bacteria might be the hosts for ARGs and MGEs. This study showed that plastisphere could be repositories of ARGs and MGEs in sewage and accumulated potential pathogenic bacteria. Unlabelled Image • The adsorption capacity of TC, AMP and TCS on PVC was higher than that of PE. • PE was corrupted by bacteria, and more conducive to microbial attachment than PVC. • Co-occurrence of TC and MPs led to a higher risk of spreading ARGs and MGEs. • The potential pathogenic bacteria, ARGs and MGEs were enriched on plastisphere. • Legionella , Mycobacterium , Neisseria and Arcobacter might be the hosts for ARGs.",20210510,"Wang, Zhiqi ; Gao, Jingfeng ; Zhao, Yifan ; Dai, Huihui ; Jia, Jingxin ; Zhang, Da",Article,Academic Journal,May2021,true,Science of the Total Environment,,JOUR,,,0048-9697,,,,,eng,Elsevier B.V.,N.PAG,N.PAG,,768,,10.1016/j.scitotenv.2020.144663,,3QW,,https://research.ebsco.com/linkprocessor/plink?id=3523047a-9bff-399f-ad22-3cd8146e7abc
GreenFILE,8gh,175605750,Photoaged microplastics enhanced the antibiotic resistance dissemination in WWTPs by altering the adsorption behavior of antibiotic resistance plasmids.,,20240401,"Guo, Qian ; Wang, Mengjun ; Jin, Siyuan ; Ni, Haohua ; Wang, Shuping ; Chen, Jie ; Zhao, Wenlu ; Fang, Zhiguo ; Li, Zhiheng ; Liu, Huijun",Article,Academic Journal,Apr2024,true,Science of the Total Environment,,JOUR,,,0048-9697,,,,,eng,Elsevier B.V.,N.PAG,N.PAG,,919,,10.1016/j.scitotenv.2024.170824,,3QW,,https://research.ebsco.com/linkprocessor/plink?id=57bb5685-9e2b-3303-ac01-a01039add95e
GreenFILE,8gh,147813442,Early and differential bacterial colonization on microplastics deployed into the effluents of wastewater treatment plants.,"Microbial colonization of microplastics (MPs) in aquatic ecosystems is a well-known phenomenon; however, there is insufficient knowledge of the early colonization phase. Wastewater treatment plant (WWTP) effluents have been proposed as important pathways for MPs entry and transport in aquatic environments and are hotspots of bacterial pathogens and antibiotic resistance genes (ARGs). This study aimed at characterizing bacterial communities in the early stage of biofilm formation on seven different types of MPs deployed in two different WWTPs effluents as well as measuring the relative abundance of two ARGs (sulI and tetM) on the tested MPs. Illumina Miseq sequencing of the 16S rRNA showed significant higher diversity of bacteria on MPs in comparison with free-living bacteria in the WWTP effluents. β-diversity analysis showed that the in situ environment (sampling site) and hydrophobicity, to a lesser extent, had a role in the early bacterial colonization phase. An early colonization phase MPs-core microbiome could be identified. Furthermore, specific core microbiomes for each type of polymer suggested that each type might select early attachment of bacteria. Although the tested WWTP effluent waters contained antibiotic resistant bacteria (ARBs) harboring the sulI and tetM ARGs, MPs concentrated ARBs harboring the sulI gene but not tetM. These results highlight the relevance of the early attachment phase in the development of bacterial biofilms on different types of MP polymers and the role that different types of polymers might have facilitating the attachment of specific bacteria, some of which might carry ARGs. Unlabelled Image • Early colonization of seven types of microplastics in WWTP effluents was assessed. • In situ environment and hydrophobicity explained bacterial diversity. • An early colonization phase MPs-core microbiome was identified. • Each tested MP was found to select early attachment of specific bacteria. • MPs could act as vector of antibiotic resistance genes.",20210225,"Martínez-Campos, Sergio ; González-Pleiter, Miguel ; Fernández-Piñas, Francisca ; Rosal, Roberto ; Leganés, Francisco",Article,Academic Journal,Feb2021,true,Science of the Total Environment,,JOUR,,,0048-9697,,,,,eng,Elsevier B.V.,N.PAG,N.PAG,,757,,10.1016/j.scitotenv.2020.143832,,3QW,,https://research.ebsco.com/linkprocessor/plink?id=986cecb9-98ea-3f89-abe2-10efd9e3627f
GreenFILE,8gh,173475567,Combined effects of microplastics and antibiotic-resistant bacteria on Daphnia magna growth and expression of functional genes.,,20231220,"Chen, Xiaofeng ; Wang, Xiaocui ; Huang, Yuanyin ; Zhu, Ziying ; Li, Tianmu ; Cai, Zeming ; Li, Minqian ; Gong, Han ; Yan, Muting",Article,Academic Journal,Dec2023,true,Science of the Total Environment,,JOUR,,,0048-9697,,,,,eng,Elsevier B.V.,N.PAG,N.PAG,,905,,10.1016/j.scitotenv.2023.166880,,3QW,,https://research.ebsco.com/linkprocessor/plink?id=736b9a54-041c-3f8f-97c1-5a2aca2a6c0a
GreenFILE,8gh,146342253,Consumer green behaviour: An approach towards environmental sustainability.,"Latest report of NASA claims that planet average surface temperature has risen about 1.62°F since the late 19th century because of increased human‐made emissions into atmosphere. Due to recent COVID‐19 pandemic, this planet is getting relief from pollution, as Wright stated that the sudden fall in pollution is observed in India, a country having world's 30 most polluted cities, similarly Gohd stated that satellite track emissions drop over china during this coronavirus outbreak. These facts showing, human is responsible to increase the pollution in this planet, therefore current study aims to test a model which can help in changing consumer behavior into consumer green behavior. A significant trend has been observed towards the recognition of the strategic importance of protecting the environment by enforcing laws. These kind of efforts are in favor of reducing consumption of plastic bags, and the need for practical and rapid measures to reduce the amount of plastic waste has increased, especially nylon bags, has increased. However, plastic bags are still the most common and used by many individuals, who prefer them to others to put their needs and belongings and their various purchases, or to save their food and drink because of its ease. Data were collected from shoppers at Cyberjaya (Malaysia) and Bangkok (Thailand). Findings indicate that knowledge and attitude have a significant and positive impact on consumer green behavior; the study also identified that the ban on plastic bags also has a significant and positive influence on consumer green behavior. This more considerable influence shows the need for such governmental interventions to moderate consumers' environmentally unfriendly behavior, and we cannot merely rely on consumers' acknowledgement of understanding the danger.",20200901,"Khan, Muhammad Shahid ; Saengon, Poramet ; Alganad, Amr Mohammed Nasser ; Chongcharoen, Duangkamol ; Farrukh, Muhammad",Article,Academic Journal,Sep/Oct2020,true,Sustainable Development,Sustainability ; Bangkok (Thailand) ; ASEAN ; United States. National Aeronautics & Space Administration ; Consumer behavior ; Plastic bag laws ; COVID-19 pandemic ; Behavior ; Young consumers,JOUR,,,0968-0802,,,,,eng,Wiley-Blackwell,1180,1168,13,28,5,10.1002/sd.2066,,KOH,,https://research.ebsco.com/linkprocessor/plink?id=4defc3f0-d32e-3a5d-98a6-2fefed22235c
GreenFILE,8gh,173564653,Deterioration of sludge characteristics and promotion of antibiotic resistance genes spread with the co-existing of polyvinylchloride microplastics and tetracycline in the sequencing batch reactor.,,20240101,"Liu, Qiangwei ; Li, Yuxin ; Sun, Yanan ; Xie, Kunpeng ; Zeng, Qianzhi ; Hao, Yiming ; Yang, Qing ; Pu, Yunhong ; Shi, Shengnan ; Gong, Zheng",Article,Academic Journal,Jan2024,true,Science of the Total Environment,,JOUR,,,0048-9697,,,,,eng,Elsevier B.V.,N.PAG,N.PAG,,906,,10.1016/j.scitotenv.2023.167544,,3QW,,https://research.ebsco.com/linkprocessor/plink?id=d1525e4a-4b1f-3983-aa00-788759e6b221
GreenFILE,8gh,173564456,"Review of emerging contaminants in green stormwater infrastructure: Antibiotic resistance genes, microplastics, tire wear particles, PFAS, and temperature.",,20240101,"Bodus, Benjamin ; O'Malley, Kassidy ; Dieter, Greg ; Gunawardana, Charitha ; McDonald, Walter",Article,Academic Journal,Jan2024,true,Science of the Total Environment,,JOUR,,,0048-9697,,,,,eng,Elsevier B.V.,N.PAG,N.PAG,,906,,10.1016/j.scitotenv.2023.167195,,3QW,,https://research.ebsco.com/linkprocessor/plink?id=b797acf1-d806-3775-a5a1-15b5318b70db
GreenFILE,8gh,143658468,Microplastics combined with tetracycline in soils facilitate the formation of antibiotic resistance in the Enchytraeus crypticus microbiome.,"Growing evidence suggests that microplastics can adsorb antibiotics and may consequently exacerbate effects on the health of exposed organisms. Our current understanding of the combined effects of microplastics and antibiotics on antibiotic resistance genes (ARGs) in soil invertebrates is limited. This study aimed to investigate changes in the microbiome and ARGs in Enchytraeus crypticus following exposure to a soil environment that contained both microplastics and antibiotics. Tetracycline (TC), polyamide (PA) and polyvinyl chloride (PVC) were used to construct microcosms of polluted soil environments (TC, PA, PVC, PA+TC, PVC+TC). The differences in microbiomes and ARGs were determined by bacterial 16S rRNA gene amplicon sequencing and high throughput quantitative PCR. The results show that compared with the Control or microplastics alone treatments, TC was significantly accumulated in E. crypticus when exposed to TC alone or in combination with microplastics (P < 0.05), but there were no significant differences about TC accumulation between TC, PA+TC, and PVC+TC treated E. crypticus (P > 0.05). Microplastics and TC significantly disturbed the microbial community, and decreased the microbial alpha diversity of E. crypticus (P < 0.05). However, there were no significant differences between TC, microplastics and their combined exposure treatments, and no toxic synergies on the diversity of E. crypticus microbiome between tetracycline and microplastics in soil environment. All the treatments increased the diversity of ARGs in E. crypticus (39–49 ARGs vs. 25 ARGs of control). In particular, treatments combining PVC and TC or PA and TC exposure resulted in greater ARGs abundance than the treatments when E. crypticus was exposed to PVC, PA or TC alone. These results add to our understanding of the combined effects of microplastics and antibiotics on the ARGs and microbiome of soil invertebrates. Image 1 • Tetracycline and microplastics disturbed the microbial community in E. crypticus. • Tetracycline and microplastics decreased the microbial diversity of E. crypticus. • Tetracycline and microplastics facilitated the incidence of ARGs in E. crypticus. Soil combined pollution by different microplastics with tetracycline increase the incidence of ARGs in the Enchytraeus crypticus microbiome.",20200901,"Ma, Jun ; Sheng, G. Daniel ; O'Connor, Patrick",Article,Academic Journal,Sep2020,true,Environmental Pollution,Soil formation ; Soil invertebrates ; Drug resistance in bacteria ; Tetracycline ; Ribosomal RNA ; Microbial diversity,JOUR,,,0269-7491,,,,,eng,Elsevier B.V.,N.PAG,N.PAG,,264,,10.1016/j.envpol.2020.114689,,JE4,,https://research.ebsco.com/linkprocessor/plink?id=4264c7ba-be1e-3c86-b7ea-67a7c3dd92e0
GreenFILE,8gh,164158192,"Combined effects of microplastics and chlortetracycline on the intestinal barrier, gut microbiota, and antibiotic resistome of Muscovy ducks (Cairina moschata).",,20230820,"Liu, Bing ; Yu, Dongyou ; Ge, Chaoyue ; Luo, Xinyu ; Du, Linna ; Zhang, Xiaoping ; Hui, Cai",Article,Academic Journal,Aug2023,true,Science of the Total Environment,,JOUR,,,0048-9697,,,,,eng,Elsevier B.V.,N.PAG,N.PAG,,887,,10.1016/j.scitotenv.2023.164050,,3QW,,https://research.ebsco.com/linkprocessor/plink?id=21be2b2d-8826-3f18-9ef9-f5539aaaed54
GreenFILE,8gh,169921484,Effects of long-term microplastic pollution on soil heavy metals and metal resistance genes: Distribution patterns and synergistic effects.,"Heavy metals (HMs) and microplastics (MPs) are two emerging factors threatening global food security. Whether long-term MPs pollution will affect the distribution of HMs and their resistance genes (MRGs) in soil is unknown. Here, metagenomic approach was used to decipher the fate of MRGs in cropland soils with long-term film MPs residues. Similar distribution pattern of MRGs was formed in long-term film MPs contaminated soil. A total of 202 MRG subtypes were detected, with resistance genes for Multimetal, Cu, and As being the most prevalent type of MRGs. MRGs formed a modular distribution of five clusters centered on MRGs including ruvB in long-term film MPs contaminated soil. MRGs also formed tight co-occurrence networks with mobile genetic elements (MGEs: integrons, insertions and plasmids). Redundancy analysis showed that HMs together with microbial communities and MGEs affected the distribution of MRGs in soil. Thirteen genera including Pseudomonas were identified as potential hosts for MRGs and MGEs. The research provides preliminary progress on the synergistic effect of HMs and MPs in affecting soil ecological security. The synergistic effect of MPs and HMs needs to be considered in the remediation of contaminated soils. [Display omitted] • Ni is the most polluted HMs in long-term film MPs-contaminated soil. • Similar distribution patterns of MRGs formed in long-term film MPs-contaminated soil. • Environmental factors jointly affected the distribution pattern of MRGs. • Thirteen genera identified as potential hosts for MRGs and MGEs. • The synergistic effect of MPs and HMs needs to be considered.",20230901,"Wu, Changcai ; Song, Xianpeng ; Wang, Dan ; Ma, Yajie ; Ren, Xiangliang ; Hu, Hongyan ; Shan, Yongpan ; Ma, Xiaoyan ; Cui, Jinjie ; Ma, Yan",Article,Academic Journal,Sep2023,true,Ecotoxicology & Environmental Safety,Heavy metal toxicology ; Soil remediation ; Heavy metals ; Environmental security ; Mobile genetic elements ; Modular forms,JOUR,,,0147-6513,,,,,eng,Academic Press Inc.,N.PAG,N.PAG,,262,,10.1016/j.ecoenv.2023.115180,,L0E,,https://research.ebsco.com/linkprocessor/plink?id=dc34c63d-6b40-3c9f-9381-943f27128846
GreenFILE,8gh,173758879,Selection for antimicrobial resistance in the plastisphere.,,20240115,"Stevenson, Emily M. ; Buckling, Angus ; Cole, Matthew ; Lindeque, Penelope K. ; Murray, Aimee K.",Article,Academic Journal,Jan2024,true,Science of the Total Environment,,JOUR,,,0048-9697,,,,,eng,Elsevier B.V.,N.PAG,N.PAG,,908,,10.1016/j.scitotenv.2023.168234,,3QW,,https://research.ebsco.com/linkprocessor/plink?id=3472e1a5-808b-3576-9556-6f396f160756
GreenFILE,8gh,173322292,"Prevalence of pharmaceuticals and personal care products, microplastics and co-infecting microbes in the post-COVID-19 era and its implications on antimicrobial resistance and potential endocrine disruptive effects.",,20231215,"Kumar, Manish ; Mazumder, Payal ; Silori, Rahul ; Manna, Suvendu ; Panday, Durga Prasad ; Das, Nilotpal ; Sethy, Susanta Kumar ; Kuroda, Keisuke ; Mahapatra, Durga Madhab ; Mahlknecht, Jürgen ; Tyagi, Vinay Kumar ; Singh, Rajesh ; Zang, Jian ; Barceló, Damià",Article,Academic Journal,Dec2023,true,Science of the Total Environment,,JOUR,,,0048-9697,,,,,eng,Elsevier B.V.,N.PAG,N.PAG,,904,,10.1016/j.scitotenv.2023.166419,,3QW,,https://research.ebsco.com/linkprocessor/plink?id=980099e1-1456-3135-b744-d0895044eab4
GreenFILE,8gh,180822526,"Potential for nutrients reuse, carbon sequestration, and CO2 emissions reduction in the practice of domestic and industrial wastewater recycling into agricultural soils: A review.","This review assesses the feasibility of reusing treated wastewater for irrigation in agricultural soils as a strategy for nutrients recycling and mitigation of CO 2 emissions. Through a literature review, it was examined wastewater sources enriched with carbon and nutrients, including municipal wastewater and associated sludge, vinasse, swine wastewater, as well as wastewater from the food industry and paper and pulp production. The review also explores the dynamics of organic matter within the soil, discussing the aspects related to its potential conversion to CO 2 or long-term storage. It was found that industrial wastewaters, owing to their higher organic matter and recalcitrance, exhibit greater potential for carbon storage. However, the presence of pollutants in wastewater necessitates careful consideration, particularly concerning their impact on soil quality. Toxic metals, microplastics, and organic compounds emerged as significant contaminants that could accumulate in the soil, posing risks to ecosystem health. To mitigate the environmental impacts, it was evaluated various wastewater treatment technologies and their associated carbon emissions. While advanced treatments may effectively reduce the contaminant load and mitigate soil impacts, their adoption is often associated with an increase in CO 2 emissions. Membrane bioreactors, microfiltration, ultrafiltration, and up-flow anaerobic sludge blanket reactors were identified as promising technologies with lower carbon footprints. Looking ahead, future research should aim to enhance the understanding of carbon dynamics in soil and validate the environmental impacts of treated wastewater disposal. Despite remaining uncertainties, the literature indicates a positive outlook for wastewater recycling in soil, offering a viable strategy for carbon storage and mitigation of greenhouse gas emissions. [Display omitted] • The carbon dynamics within soil systems remain poorly understood. • Industrial wastewaters contain higher concentrations of carbon suitable for storage within soil. • Antibiotic resistance genes pose minimal concern due to their short lifespan within soil. • Trace metals and microplastics from wastewaters have the potential to accumulate over time.",20241101,"Carpanez, Thais Girardi ; Silva, Jonathas Batista Gonçalves ; Otenio, Marcelo Henrique ; Amaral, Míriam Cristina Santos ; Moreira, Victor Rezende",Article,Academic Journal,Nov2024,true,Journal of Environmental Management,Greenhouse gas mitigation ; Industrial wastes ; Carbon dioxide mitigation ; Sewage sludge ; Sewage ; Upflow anaerobic sludge blanket reactors,JOUR,,,0301-4797,,,,,eng,Academic Press Inc.,N.PAG,N.PAG,,370,,10.1016/j.jenvman.2024.122443,,EMJ,,https://research.ebsco.com/linkprocessor/plink?id=6800a008-2eb9-3853-bfd5-67d485bbc69c
GreenFILE,8gh,162009923,Photoaging processes of polyvinyl chloride microplastics enhance the adsorption of tetracycline and facilitate the formation of antibiotic resistance.,"Microplastics (MPs), antibiotics and microorganism ubiquitously coexist in aquatic environments. MPs inevitably undergo photoaging processes in aquatic environments, affecting the interactions between MPs and antibiotics and the antibiotic resistance of microorganism. In this study, the impact of photoaging processes of MPs on their adsorption behavior of tetracycline (TC) and related formation of antibiotic resistance were investigated. It was found that the photoaging processes significantly increased the adsorption capacity of TC onto MPs, with the Q e increasing from 0.387 to 0.507 mg/g at 288 K and from 0.507 to 0.688 mg/g at 308 K. The site energy distribution (SED) analysis further confirmed that the enhanced adsorption capacity was attributed to more high-energy adsorption sites acquired from MPs photoaging processes. Moreover, the enhanced adsorption of TC further facilitated the formation of seven antibiotic resistance genes (i.e., tetA , tetB , tetC , tetD , tetE , tetG , tetK) when MPs adsorbed with TC was covered by biofilm. This study helps comprehensively understand the environmental behaviors of co-existing MPs, antibiotics and microorganisms, providing a theoretical basis for evaluating and mitigating their coexistence risks. [Display omitted] • The photoaging processes altered the physiochemical properties of MPs. • The aging processes increased the adsorption capacity of TC onto MPs. • More high-energy sites on aged PVC MPs resulted in a higher adsorption capability. • The enhanced adsorption of TC further facilitated the formation of antibiotic resistance. • The photoaging processes of MPs increase their risk of carrying pathogenic bacteria.",20230415,"Tian, Yajun ; Zhu, Jianyu ; Ying, Chuhan ; Luo, Hongwei ; Zhang, Shoufeng ; Zhang, Liqiu ; Li, Renna ; Li, Jun",Article,Academic Journal,Apr2023,true,Chemosphere,Polyvinyl chloride ; Antibiotics ; Drug resistance in bacteria ; Drug resistance in microorganisms ; Tetracycline ; Microplastics ; Tetracyclines,JOUR,,,0045-6535,,,,,eng,Elsevier B.V.,N.PAG,N.PAG,,320,,10.1016/j.chemosphere.2023.137820,,JQF,,https://research.ebsco.com/linkprocessor/plink?id=6f4dd73c-7d30-3242-afe7-f902c40a1132
