longDBName,shortDBName,an,title,abstract,publicationDate,contributors,docTypes,pubTypes,coverDate,peerReviewed,source,subjects,isiType,doids,isbns,issns,publisherLocations,identifiers,isOpenAccess,bookEdition,language,publisher,pageEnd,pageStart,pageCount,volume,issue,doi,notes,mid,degreeLevel,plink
GreenFILE,8gh,169815129,Effects of soil solarization combined with manure-amended on soil ARGs and microbial communities during summer fallow.,"Soil solarization (SS) is a technique for managing pathogens and weeds, which involves covering with transparent plastic to increase soil temperature during summer fallow (SF). However, SS also alters the diversity of bacterial communities. Therefore, during SF, various organic modifiers are used in combination with SS to improve its efficacy. Organic amendments may contain antibiotic resistance genes (ARGs). Greenhouse vegetable production (GVP) soils are vital to ensure food security and ecological balance. However, comprehensive study on the effects of SS combined with different types of manure on ARGs in GVP soils during SF remains unclear. Therefore, this study employed high-throughput qPCR to explore the effects of different organic amendments combined with SS on the abundance changes of ARGs and mobile genetic elements (MGEs) in GVP soils during SF. The abundance and diversity of ARGs and MGEs in GVP soils with different manure fertilization and SS decreased during SF. Horizontal gene transfer via MGEs (especially integrases 45.80%) induced by changes in environmental factors (NO 3 <sup>−</sup>-N 14.7% and NH 4 <sup>+</sup>-N) was the main factor responsible for the changes in ARGs. Proteobacteria (14.3%) and Firmicutes were the main potential hosts of ARGs. Network analysis suggested that Ornithinimicrobium , Idiomarina and Corynebacterium had positive correlations with aminoglycosides, MLSB, and tetracycline resistance genes. These results provide new insights to understand the fate of ARGs in the GVP soils by manure-amended combined with SS during SF, which may help to reduce the spread of ARGs. [Display omitted] • SS combined with different manures application alleviated the ARGs transmission during SF. • During SF, BM mainly reduced Multidrugs, while CM reduced Beta_ Lactamase (21). • HGT via MGEs contributed more to ARGs abundance than physicochemical properties and microbial. • Potential hosts of ARGs mainly belonged to Proteobacteria and Firmicutes.",20230915,"Wang, Xiaojuan ; Zhang, Li ; Gu, Jie ; Feng, Yucheng ; He, Kai ; Jiang, Haihong",Article,Academic Journal,Sep2023,true,Environmental Pollution,Microbial communities ; Fallowing ; Manures ; Bacterial communities ; Mobile genetic elements ; Horizontal gene transfer,JOUR,,,0269-7491,,,,,eng,Elsevier B.V.,N.PAG,N.PAG,,333,,10.1016/j.envpol.2023.121950,,JE4,,https://research.ebsco.com/linkprocessor/plink?id=62b1e8d6-9544-3d8e-a973-7ce27f02df5c
GreenFILE,8gh,161693843,"Understanding the underestimated: Occurrence, distribution, and interactions of microplastics in the sediment and soil of China, India, and Japan.","Microplastics (MPs) are non-biodegradable substances that can sustain our environment for up to a century. What is more worrying is the incapability of modern technologies to annihilate MPs from om environment. One ramification of MPs is their impact on every kind of life form on this planet, which has been discussed ahead; that is why these substances are surfacing in everyday discussions of scholars and researchers. This paper discusses the overview of the global occurrence, abundance, analysis, and remediation techniques of MPs in the environment. This paper primarily reviews the event and abundance of MPs in coastal sediments and agricultural soil of three major Asian countries, India, China, and Japan. A significant concentration of MPs has been recorded from these countries, which affirms its strong presence and subsequent environmental impacts. Concentrations such as 73,100 MPs/kg in Indian coastal sediments and 42,960 particles/kg in the agricultural soil of China is a solid testimony to prove their massive outbreak in our environment and require urgent attention towards this issue. Conclusions show that human activities, rivers, and plastic mulching on agricultural fields have majorly acted as carriers of MPs towards coastal and terrestrial soil and sediments. Later, based on recorded concentrations and gaps, future research studies are recommended in the concerned domain; a dearth of studies on MPs influencing Indian agricultural soil make a whole sector and its consumer vulnerable to the adverse effects of this emerging contaminant. [Display omitted] • Film & fibre shaped microplastics (MPs) are more abundant in India, China and Japan. • Plastic mulching is the root cause of major MPs pollution in soil and sediment. • Estuarian soil/sediment are more prone to MPs pollution than terrestrial and coastal. • FT-IR is highly used for MPs identification; mass spectrometry & microscopy are least. • MPs work as a vector for metals, PPCPs, surfactants and antibiotic resistance genes (ARGs).",20230301,"Silori, Rahul ; Shrivastava, Vikalp ; Mazumder, Payal ; Mootapally, Chandrashekar ; Pandey, Ashok ; Kumar, Manish",Article,Academic Journal,Mar2023,true,Environmental Pollution,Coastal sediments ; Soil pollution ; Soils ; Andosols ; China ; India ; Japan ; Microplastics ; Plastic mulching,JOUR,,,0269-7491,,,,,eng,Elsevier B.V.,N.PAG,N.PAG,,320,,10.1016/j.envpol.2022.120978,,JE4,,https://research.ebsco.com/linkprocessor/plink?id=a7755d65-e35f-3ae7-af0b-c64fed242f23
GreenFILE,8gh,155458395,Viral diversity and potential environmental risk in microplastic at watershed scale: Evidence from metagenomic analysis of plastisphere.,"[Display omitted] • Microplastic is an important vector for the attachment and dissemination of viruses. • PP has the highest viral diversity and environmental risk among five types of MPs. • Upstream and downstream are two major sources of viruses in MPs cultured in estuary. • MPs properties affect the composition and function of viral communities on MPs. Microplastics (MPs) have been considered as a new vector for the long-distance transport of pathogens in aquatic ecosystems. However, the composition of viral communities attached on MPs and their environmental risk are largely unknown. Here, we profiled the viral diversity and potential risk in five different MPs collected from the Beilun River based on metagenomic analysis. Nearly 2863 million raw reads were produced and assembled, and annotation resulted in the identification of 1719 different species of viruses in MPs. Viruses in polypropylene (PP) displayed the highest diversity, with about 250 specific viruses detected. Source tracking of viruses in MPs by the fast expectation–maximization microbial source tracking method (FEAST) demonstrated that viruses in upstream and downstream MPs are two major sources of viruses in estuary. Furthermore, the MP-type-dependent potential environmental risk of viruses was significant based on both antibiotic resistance genes (ARGs) and virulence factors (VFs) detected in viral metagenomes, and PP was confirmed with the highest potential environmental risk. This study reveals the high diversity and potential environmental risk of viruses in different MPs, and provides an important guidance for future environmental monitoring and understanding the potential risks associated with both viral transmission and MPs pollution.",20220301,"Li, Ruilong ; Zhu, Longji ; Cui, Li ; Zhu, Yong-Guan",Article,Academic Journal,Mar2022,true,Environment International,Environmental risk ; Metagenomics ; Watersheds ; Viral transmission ; Drug resistance in bacteria,JOUR,,,0160-4120,,,,,eng,Elsevier B.V.,N.PAG,N.PAG,,161,,10.1016/j.envint.2022.107146,,JQ0,,https://research.ebsco.com/linkprocessor/plink?id=71e4be56-ec79-3560-8855-fe397266fdcb
GreenFILE,8gh,178649991,"Unraveling the effect of micro/nanoplastics on the occurrence and horizontal transfer of environmental antibiotic resistance genes: Advances, mechanisms and future prospects.",,20241015,"Shi, Jianhong ; Sun, Chaoli ; An, Tingxuan ; Jiang, Changhai ; Mei, Shenglong ; Lv, Baoyi",Article,Academic Journal,Oct2024,true,Science of the Total Environment,,JOUR,,,0048-9697,,,,,eng,Elsevier B.V.,N.PAG,N.PAG,,947,,10.1016/j.scitotenv.2024.174466,,3QW,,https://research.ebsco.com/linkprocessor/plink?id=12f50f00-cf48-3ac0-a648-519bd7e10d17
GreenFILE,8gh,127815280,Microplastics increase impact of treated wastewater on freshwater microbial community.,"Plastic pollution is a major global concern with several million microplastic particles entering every day freshwater ecosystems via wastewater discharge. Microplastic particles stimulate biofilm formation (plastisphere) throughout the water column and have the potential to affect microbial community structure if they accumulate in pelagic waters, especially enhancing the proliferation of biohazardous bacteria. To test this scenario, we simulated the inflow of treated wastewater into a temperate lake using a continuous culture system with a gradient of concentration of microplastic particles. We followed the effect of microplastics on the microbial community structure and on the occurrence of integrase 1 ( int 1), a marker associated with mobile genetic elements known as a proxy for anthropogenic effects on the spread of antimicrobial resistance genes. The abundance of int 1 increased in the plastisphere with increasing microplastic particle concentration, but not in the water surrounding the microplastic particles. Likewise, the microbial community on microplastic was more similar to the original wastewater community with increasing microplastic concentrations. Our results show that microplastic particles indeed promote persistence of typical indicators of microbial anthropogenic pollution in natural waters, and substantiate that their removal from treated wastewater should be prioritised.",20180301,"Eckert, Ester M. ; Di Cesare, Andrea ; Kettner, Marie Therese ; Arias-Andres, Maria ; Fontaneto, Diego ; Grossart, Hans-Peter ; Corno, Gianluca",Article,Academic Journal,Mar2018,true,Environmental Pollution,Plastic marine debris ; Wastewater treatment ; Aquatic microbiology ; Microbial communities ; Freshwater ecology,JOUR,,,0269-7491,,,,,eng,Elsevier B.V.,502,495,8,234,,10.1016/j.envpol.2017.11.070,,JE4,,https://research.ebsco.com/linkprocessor/plink?id=55eb0b2e-5a0c-3af4-8308-909409c044ce
GreenFILE,8gh,160784829,Solid-liquid interface adsorption of antibiotic resistance plasmids induced by nanoplastics aggravates gene pollution in aquatic ecosystems.,"Antibiotic resistance genes (ARGs) and nanoplastics (NPs) have been identified as emerging pollutants in water environment; the interactions between antibiotic resistance plasmids (ARPs) and NPs will influence ARG transport in sediments. Herein, the adsorption experiments of a typical ARP onto polystyrene nanoplastics (PS-NPs) in river and lake sediments were conducted to elucidate the adsorption mechanisms and the effects of environmental factors. Results indicated that the adsorption amounts of PS-NPs increased with the dosages while decreased with the particle size of sediments. Multi-layer adsorption of PS-NPs was found to exist mainly in sand and silt sediments, whereas the filling adsorption dominated in the clay. Moreover, the adsorbed PS-NPs enhanced the physisorption of ARPs in sediments through stimulating the intraparticle diffusion of ARPs induced by electrostatic force. Besides, the adsorption amounts of ARPs onto the PS-NPs decreased with the increasing pH and dissolve organic matter due to the enhanced electrostatic repulsion and competitive adsorption. The ion strength played catalytic roles by increasing the electrostatic attraction and adsorption sites of ARPs on PS-NPs. The adsorbed ARPs in sediments were closely related with the ARGs in extra/intracellular DNA of biofilms, influencing the distribution and proliferation of ARGs largely. The findings indicate that ARG-associated pollution might be enhanced by the solid-liquid interface adsorption induced by NPs, which was controlled by pH, ion strength and dissolve organic matter. This study provides supplementary insights into the roles of NPs as carriers of ARP in sediments, and advances our understanding on the risks of NP-ARG co-occurring contamination in aquatic ecosystems. [Display omitted] • Nanoparticle adsorption was affected by sediment composition and particle size. • Nanoparticles enhanced ARP diffusion and affinity by electrostatic force. • PH, ion strength and the dissolved organic matter affected ARP adsorption. • Relative abundance of ARGs in biofilms was positively related to absorbed ARPs.",20230101,"Li, Zhiheng ; Wang, Mengjun ; Fang, Hong ; Yao, Zhangchao ; Liu, Huijun ; Zhao, Wenlu ; Chen, Jie",Article,Academic Journal,Jan2023:Part 1,true,Environmental Pollution,Water pollution ; Emerging contaminants ; Dissolved organic matter ; Diffusion ; Solid-liquid interfaces ; Drug resistance in bacteria,JOUR,,,0269-7491,,,,,eng,Elsevier B.V.,N.PAG,N.PAG,,316,,10.1016/j.envpol.2022.120456,,JE4,,https://research.ebsco.com/linkprocessor/plink?id=3d41065d-c19a-3661-af0c-aec36f0f9413
GreenFILE,8gh,157526405,Plastic properties affect the composition of prokaryotic and eukaryotic communities and further regulate the ARGs in their surface biofilms.,,20220920,"Guo, Xing-pan ; Chen, Yu-Ru ; Sun, Xiao-li ; Li, Cui-lan ; Hou, Li-jun ; Liu, Min ; Yang, Yi",Article,Academic Journal,Sep2022,true,Science of the Total Environment,,JOUR,,,0048-9697,,,,,eng,Elsevier B.V.,N.PAG,N.PAG,,839,,10.1016/j.scitotenv.2022.156362,,3QW,,https://research.ebsco.com/linkprocessor/plink?id=c36135fd-3aee-31f8-bdbc-c1beb8726961
GreenFILE,8gh,160292507,Growth and prevalence of antibiotic-resistant bacteria in microplastic biofilm from wastewater treatment plant effluents.,,20230120,"Perveen, Shabila ; Pablos, Cristina ; Reynolds, Ken ; Stanley, Simon ; Marugán, Javier",Article,Academic Journal,Jan2023:Part 2,true,Science of the Total Environment,,JOUR,,,0048-9697,,,,,eng,Elsevier B.V.,N.PAG,N.PAG,,856,,10.1016/j.scitotenv.2022.159024,,3QW,,https://research.ebsco.com/linkprocessor/plink?id=04795e6a-f386-3b15-90bf-3ba047d2c256
GreenFILE,8gh,178649942,Impact of aging of primary and secondary polystyrene nanoplastics on the transmission of antibiotic resistance genes in anaerobic digestion.,,20241015,"Haffiez, Nervana ; Kalantar, Elnaz ; Zakaria, Basem S. ; Azizi, Seyed Mohammad Mirsoleimani ; Farner, Jeffrey M. ; Dhar, Bipro Ranjan",Article,Academic Journal,Oct2024,true,Science of the Total Environment,,JOUR,,,0048-9697,,,,,eng,Elsevier B.V.,N.PAG,N.PAG,,947,,10.1016/j.scitotenv.2024.174213,,3QW,,https://research.ebsco.com/linkprocessor/plink?id=6954453b-1b68-35a6-a63d-e4276a4f6c0c
GreenFILE,8gh,178022727,Accumulation of antibiotics in the environment: Have appropriate measures been taken to protect Canadian human and ecological health?,"In Canada, every day, contaminants of emerging concern (CEC) are discharged from waste treatment facilities into freshwaters. CECs such as pharmaceutical active compounds (PhACs), personal care products (PCPs), per- and polyfluoroalkyl substances (PFAS), and microplastics are legally discharged from sewage treatment plants (STPs), water reclamation plants (WRPs), hospital wastewater treatment plants (HWWTPs), or other forms of wastewater treatment facilities (WWTFs). In 2006, the Government of Canada established the Chemicals Management Plan (CMP) to classify chemicals based on a risk-priority assessment, which ranked many CECs such as PhACs as being of low urgency, therefore permitting these substances to continue being released into the environment at unmonitored rates. The problem with ranking PhACs as a low priority is that CMP's risk management assessment overlooks the long-term environmental and synergistic effects of PhAC accumulation, such as the long-term risk of antibiotic CEC accumulation in the spread of antibiotic resistance genes. The goal of this review is to specifically investigate antibiotic CEC accumulation and associated environmental risks to human and environmental health, as well as to determine whether appropriate legislative strategies are in place within Canada's governance framework. In this research, secondary data on antibiotic CEC levels in Canadian and international wastewaters, their potential to promote antibiotic-resistant residues, associated environmental short- and long-term risks, and synergistic effects were all considered. Unlike similar past reviews, this review employed an interdisciplinary approach to propose new strategies from the perspectives of science, engineering, and law. • Antibiotics as contaminants of emerging concern are increasing being released from WWTPs and give rise to ARB and ARG. • The current Canadian Chemical Management Plan (CMP) does not include routine monitoring of antibiotic CECs from wastewater. • Knowledge gaps between scientific data and policy need to be addressed. • A precautionary principle needs to be adopted to prevent antibiotic CECs from becoming long term health risks.",20240715,"Aladekoyi, Oluwatosin ; Siddiqui, Salsabil ; Hania, Patricia ; Hamza, Rania ; Gilbride, Kimberley",Article,Academic Journal,Jul2024,true,Ecotoxicology & Environmental Safety,Environmental health ; Emerging contaminants ; Sewage disposal plants ; Water reuse ; Canada ; Antibiotic residues ; Fluoroalkyl compounds,JOUR,,,0147-6513,,,,,eng,Academic Press Inc.,N.PAG,N.PAG,,280,,10.1016/j.ecoenv.2024.116513,,L0E,,https://research.ebsco.com/linkprocessor/plink?id=814d6544-f127-3809-8e72-54d6fd065916
GreenFILE,8gh,162540085,Size-dependent effects of polystyrene microplastics on gut metagenome and antibiotic resistance in C57BL/6 mice.,"Microplastic pollution is an emerging threat for marine and terrestrial ecosystems, which has raised global concerns about its implications for human health. Mounting evidence has shown that the gut microbiota plays a key role in human health and diseases. The gut bacteria could be disturbed by many environmental factors, including the microplastic particles. However, the size effect of polystyrene microplastics on mycobiome, as well as gut functional metagenome has not been well studied. In this study, we performed ITS sequencing to explore the size effect of polystyrene microplastics on the fungal composition, in combination with the shotgun metagenomics sequencing to reveal the size effects of polystyrene on the functional metagenome. We found that polystyrene microplastic particles with 0.05–0.1 µm diameter showed greater impact on the bacterial and fungal composition of gut microbiota as well as the metabolic pathways than the polystyrene microplastic particles with 9–10 µm diameter. Our results suggested that size-depended effects should not be ignored in the health risk assessment of microplastics. [Display omitted] • Stronger responses to PS exposure were found in intestinal fungi than bacteria. • 0.05–0.1 µm PS showed greater impact on the gut bacterial and fungal composition. • 0.05–0.1 µm PS induced more changes in the microbial metabolic pathways. • Size-depended effects should be considered in the risk assessment of microplastics.",20230401,"Gao, Bei ; Shi, Xiaochun ; Li, Shanshan ; Xu, Weichen ; Gao, Nan ; Shan, Jinjun ; Shen, Weishou",Article,Academic Journal,Apr2023,true,Ecotoxicology & Environmental Safety,Plastic marine debris ; Polystyrene ; Health risk assessment ; Shotgun sequencing ; Microplastics ; Drug resistance in bacteria ; Laboratory mice,JOUR,,,0147-6513,,,,,eng,Academic Press Inc.,N.PAG,N.PAG,,254,,10.1016/j.ecoenv.2023.114737,,L0E,,https://research.ebsco.com/linkprocessor/plink?id=af2325e0-3e76-34e4-b7e6-8094f0493800
GreenFILE,8gh,177758463,Stable isotopes and nanoSIMS single-cell imaging reveals soil plastisphere colonizers able to assimilate sulfamethoxazole.,"The presence and accumulation of both, plastics and antibiotics in soils may lead to the colonization, selection, and propagation of soil bacteria with certain metabolic traits, e.g., antibiotic resistance, in the plastisphere. However, the impact of plastic-antibiotic tandem on the soil ecosystem functioning, particularly on microbial function and metabolism remains currently unexplored. Herein, we investigated the competence of soil bacteria to colonize plastics and degrade <sup>13</sup>C-labeled sulfamethoxazole (SMX). Using single-cell imaging, isotope tracers, soil respiration and SMX mineralization bulk measurements we show that microbial colonization of polyethylene (PE) and polystyrene (PS) surfaces takes place within the first 30 days of incubation. Morphologically diverse microorganisms were colonizing both plastic types, with a slight preference for PE substrate. CARD-FISH bacterial cell counts on PE and PS surfaces formed under SMX amendment ranged from 5.36 × 10<sup>3</sup> to 2.06 × 10<sup>4</sup>, and 2.06 × 10<sup>3</sup> to 3.43 × 10<sup>3</sup> hybridized cells mm<sup>−2</sup>, respectively. Nano-scale Secondary Ion Mass Spectrometry measurements show that <sup>13</sup>C enrichment was highest at 130 days with values up to 1.29 atom%, similar to those of the <sup>13</sup>CO 2 pool (up to 1.26 atom%, or 22.55 ‰). Independent Mann-Whitney U test showed a significant difference between the control plastisphere samples incubated without SMX and those in <sup>13</sup>C-SMX incubations (P < 0.001). Our results provide direct evidence demonstrating, at single-cell level, the capacity of bacterial colonizers of plastics to assimilate <sup>13</sup>C-SMX from contaminated soils. These findings expand our knowledge on the role of soil-seeded plastisphere microbiota in the ecological functioning of soils impacted by anthropogenic stressors. [Display omitted] • Morphologically rich microbial community is able to colonize plastic surfaces. • SEM–FISH–SIP-nanoSIMS reveals the plastisphere microbial function in situ. • Microbial colonizers on plastisphere can assimilate sulfamethoxazole.",20240815,"Xiang, Qian ; Stryhanyuk, Hryhoriy ; Schmidt, Matthias ; Kümmel, Steffen ; Richnow, Hans H. ; Zhu, Yong-Guan ; Cui, Li ; Musat, Niculina",Article,Academic Journal,Aug2024,true,Environmental Pollution,Soil microbiology ; Stable isotopes ; Secondary ion mass spectrometry ; Sulfamethoxazole ; Mann Whitney U Test,JOUR,,,0269-7491,,,,,eng,Elsevier B.V.,N.PAG,N.PAG,,355,,10.1016/j.envpol.2024.124197,,JE4,,https://research.ebsco.com/linkprocessor/plink?id=dd0cb309-8411-3f7d-88ae-b84f8131230e
GreenFILE,8gh,163946383,Microplastics as vectors of chemical contaminants and biological agents in freshwater ecosystems: Current knowledge status and future perspectives.,"Microplastics (MPs) are becoming ubiquitous, and their environmental fate is becoming an issue of concern. Our review aims to synthesize current knowledge status and provide future perspectives regarding the vector effect of MPs for chemical contaminants and biological agents. The evidence in the literature indicates that MPs are a vector for persistent organic pollutants (POPs), metals and pharmaceuticals. Concentrations of chemical contaminant in orders of six-fold higher on MPs surfaces than in the surrounding environmental waters have been reported. Chemical pollutants such as perfluoroalkyl substances (PAFSs), hexachlorocyclohexane (HCHs) and polycyclic aromatic hydrocarbons (PAHs), exhibiting polarities in the range of 3.3–9 are the commonest chemicals reported on MP surfaces. Regarding metals on MPs including chromium (Cr), lead (Pb), cobalt (Co), the presence of C–O and N–H in MPs promote a relatively high adsorption of these metals onto MP surfaces. Regarding pharmaceuticals, not much has been done, but a few studies indicate that commonly used drugs such as ibuprofen, ibuprofen, diclofenac, and naproxen have been associated with MPs. There is sufficient evidence supporting the claim that MPs can act as vectors for viruses, bacterial and antibiotic-resistant bacteria and genes, and MPs act to accelerate horizontal and vertical gene transfer. An area that deserves urgent attention is whether MPs can act as vectors for invertebrates and vertebrates, mainly non-native, invasive freshwater species. Despite the ecological significance of invasive biology, little research has been done in this regard. Overall, our review summarises the state of the current knowledge, identifies critical research gaps and provides perspectives for future research. [Display omitted] • Microplastics adsorb chemical and biological agents in aquatic environments. • The vector effect of microplastics deserve consideration in risk assessment. • Microplastic transport biological organisms in riverine systems. • Vector effects of microplastics have serious ecological implications.",20230801,"Tumwesigye, Edgar ; Felicitas Nnadozie, Chika ; C Akamagwuna, Frank ; Siwe Noundou, Xavier ; William Nyakairu, George ; Odume, Oghenekaro Nelson",Article,Academic Journal,Aug2023,true,Environmental Pollution,Plastic marine debris ; Persistent pollutants ; Pollutants ; Polycyclic aromatic hydrocarbons ; Microplastics ; Horizontal gene transfer,JOUR,,,0269-7491,,,,,eng,Elsevier B.V.,N.PAG,N.PAG,,330,,10.1016/j.envpol.2023.121829,,JE4,,https://research.ebsco.com/linkprocessor/plink?id=629f576b-eddb-3153-98f3-08b9111b398c
