longDBName,shortDBName,an,title,abstract,publicationDate,contributors,docTypes,pubTypes,coverDate,peerReviewed,source,subjects,isiType,doids,isbns,issns,publisherLocations,identifiers,isOpenAccess,bookEdition,language,publisher,pageEnd,pageStart,pageCount,volume,issue,doi,notes,mid,degreeLevel,plink
GreenFILE,8gh,164257351,Microplastic biodegradability dependent responses of plastisphere antibiotic resistance to simulated freshwater-seawater shift in onshore marine aquaculture zones.,"MPs carrying ARGs can travel between freshwater and seawater due to intensive land-sea interaction in onshore marine aquaculture zones (OMAZ). However, the response of ARGs in plastisphere with different biodegradability to freshwater-seawater shift is still unknown. In this study, ARG dynamics and associated microbiota on biodegradable poly (butyleneadipate-co-terephthalate) (PBAT) and non-biodegradable polyethylene terephthalate (PET) MPs were investigated through a simulated freshwater-seawater shift. The results exhibited that freshwater-seawater shift significantly influenced ARG abundance in plastisphere. The relative abundance of most studied ARGs decreased rapidly in plastisphere after they entered seawater from freshwater but increased on PBAT after MPs entered freshwater from seawater. Besides, the high relative abundance of multi-drug resistance (MDR) genes occurred in plastisphere, and the co-change between most ARGs and mobile genetic elements indicated the role of horizontal gene transfer on ARG regulation. Proteobacteria was dominant phylum in plastisphere and the dominant genera, such as Allorhizobium-Neorhizobium-Pararhizobium-Rhizobium , Afipia , Gemmobacter and Enhydrobacter , were significantly associated with qnr S, tet and MDR genes in plastisphere. Moreover, after MPs entered new water environment, the ARGs and microbiota genera in plastisphere changed significantly and tended to converge with those in receiving water. These results indicated that MP biodegradability and freshwater-seawater interaction influenced potential hosts and distributions of ARGs, of which biodegradable PBAT posed a high risk in ARG dissemination. This study would be helpful for understanding the impact of biodegradable MP pollution on spread of antibiotic resistance in OMAZ. [Display omitted] • ARG abundance declined with microbiota restriction as MPs entered seawater. • ARG abundance increased on PBAT but decreased on PET after MPs entered freshwater. • Biodegradable MPs enriched more ARGs than non-biodegradable ones. • ARGs and microbial structure converged with time on plastisphere and in seawater. • Freshwater-seawater shift increased MDR risks by enriching MDR genes on MPs.",20230815,"Zhou, Qian ; Zhang, Jun ; Fang, Qunkai ; Zhang, Ming ; Wang, Xiaonan ; Zhang, Daoyong ; Pan, Xiangliang",Article,Academic Journal,Aug2023:Part 1,true,Environmental Pollution,Mariculture ; Drug resistance in bacteria ; Horizontal gene transfer ; Mobile genetic elements ; Multidrug resistance,JOUR,,,0269-7491,,,,,eng,Elsevier B.V.,N.PAG,N.PAG,,331,,10.1016/j.envpol.2023.121828,,JE4,,https://research.ebsco.com/linkprocessor/plink?id=e1bc8dc3-367f-33a0-9abf-ce83f6d04941
GreenFILE,8gh,181060777,Microplastic and antibiotics in waters: Interactions and environmental risks.,"Antibiotics (ATs) are ubiquitously detected in natural waters worldwide, and their tendency to co-migrate with microplastics (MPs) post-adsorption leads to heightened environmental risk. Research on the adsorption of ATs on MPs and their subsequent effects on the environmental risks is gaining significant attention globally. This adsorption process predominantly occurs through hydrophobic forces, hydrogen bonds, and electrostatic interactions and is influenced by various environmental factors. The interaction between MPs and ATs exhibited varying degrees of efficiency across different pH levels and ionic strengths. Furthermore, this paper outlines the environmental risks associated with the co-presence of MPs and ATs in aquatic environments, emphasizing the potential effect of MPs on the distribution of antibiotic resistance genes (ARGs) and related environmental risks. The potential hazards posed by MPs and ATs in aquatic systems warrant serious consideration. Future research should concentrate on the adsorption of ATs/ARGs on MPs under real environmental conditions, horizontal gene transfer on MPs, as well as biofilm formation and agglomeration behavior on MPs that needs to be emphasized. [Display omitted] • Microplastics (MPs) and antibiotics (ATs) coexist in aquatic environments. • MPs and ATs have similar distribution patterns. • MPs selectively enrich antibiotic resistance genes (ARGs). • MPs act as carriers and migrate together with ATs and ARGs. • Adsorption affects the horizontal and vertical distribution of MPs-ATs and ARGs.",20241201,"Guo, Jiayi ; Jin, Xinbai ; Zhou, Yi ; Gao, Bowen ; Li, Yang ; Zhou, Yanbo",Article,Academic Journal,Dec2024,true,Journal of Environmental Management,Environmental risk ; Horizontal gene transfer ; Drug resistance in bacteria ; Ionic strength ; Electrostatic interaction,JOUR,,,0301-4797,,,,,eng,Academic Press Inc.,N.PAG,N.PAG,,371,,10.1016/j.jenvman.2024.123125,,EMJ,,https://research.ebsco.com/linkprocessor/plink?id=6c9622f0-d211-33db-9557-94586a5d1801
GreenFILE,8gh,163002200,"Effects of tidal action on the stability of microbiota, antibiotic resistance genes, and microplastics in the Pearl River Estuary, Guangzhou, China.","In this study, the 16S rRNA gene amplicon sequencing technique was used to explore the microbial diversity and differences in the water environment of the Pearl River Estuary in Nansha District with various land use types such as the aquaculture area, industrial area, tourist area, agricultural plantation, and residential area. At the same time, the quantity, type, abundance, and distribution of two types of emerging environmental pollutants, antibiotic resistance genes (ARGs) and microplastics (MPs), are explored in the water samples from different functional areas. The results show that the dominant phyla in the five functional regions are Proteobacteria, Actinobacteria and Bacteroidetes, and the dominant genera are Hydrogenophaga , Synechococcus , Limnohabitans and Polynucleobacter. A total of 248 ARG subtypes were detected in the five regions, belonging to nine classes of ARGs (Aminoglycoside , Beta_Lactamase , Chlor , MGEs , MLSB , Multidrug , Sul , Tet , Van). Blue and white were the dominant MP colors in the five regions; 0.5–2 mm was the dominant MP size, and cellulose, rayon, and polyester comprised the highest proportion of the plastic polymers. This study provides the basis for understanding the environmental microbial distribution in estuaries and the prevention of environmental health risks from ARGs and microplastics. [Display omitted] • Tides can influence the stability of microorganisms, ARGs and microplastics in the Pearl River. • Hydrogenophaga , Synechococcus , and Limnohabitans were the dominant genera in the Pearl River. • A total of 248 ARGs subtypes and 8 MGEs were detected in five different land use types. • Higher levels of microplastics were found in the water column during spring tides.",20230620,"Wang, Chong ; Sun, Di ; Junaid, Muhammad ; Xie, Shaolin ; Xu, Guohuan ; Li, Xiang ; Tang, Huijuan ; Zou, Jixing ; Zhou, Aiguo",Article,Academic Journal,Jun2023,true,Chemosphere,Plastic marine debris ; Pollutants ; Estuaries ; Environmental health ; Plastics ; Guangzhou (China) ; Drug resistance in bacteria ; Microplastics,JOUR,,,0045-6535,,,,,eng,Elsevier B.V.,N.PAG,N.PAG,,327,,10.1016/j.chemosphere.2023.138485,,JQF,,https://research.ebsco.com/linkprocessor/plink?id=e96d8e84-ea68-3b17-a5b0-a61cdd59b08d
GreenFILE,8gh,153323617,Bioplastic accumulates antibiotic and metal resistance genes in coastal marine sediments.,"The oceans are increasingly polluted with plastic debris, and several studies have implicated plastic as a reservoir for antibiotic resistance genes and a potential vector for antibiotic-resistant bacteria. Bioplastic is widely regarded as an environmentally friendly replacement to conventional petroleum-based plastic, but the effects of bioplastic pollution on marine environments remain largely unknown. Here, we present the first evidence that bioplastic accumulates antibiotic resistance genes (ARGs) and metal resistance genes (MRGs) in marine sediments. Biofilms fouling ceramic, polyethylene terephthalate (PET), and polyhydroxyalkanoate (PHA) were investigated by shotgun metagenomic sequencing. Four ARG groups were more abundant in PHA: trimethoprim resistance (TMP), multidrug resistance (MDR), macrolide-lincosamide-streptogramin resistance (MLS), and polymyxin resistance (PMR). One MRG group was more abundant in PHA: multimetal resistance (MMR). The relative abundance of ARGs and MRGs were strongly correlated based on a Mantel test between the Bray-Curtis dissimilarity matrices (R = 0.97, p < 0.05) and a Pearson's analysis (R = 0.96, p < 0.05). ARGs were detected in more than 40% of the 57 metagenome-assembled genomes (MAGs) while MRGs were detected in more than 90% of the MAGs. Further investigation (e.g., culturing, genome sequencing, antibiotic susceptibility testing) revealed that PHA biofilms were colonized by hemolytic Bacillus cereus group bacteria that were resistant to beta-lactams, vancomycin, and bacitracin. Taken together, our findings indicate that bioplastic, like conventional petroleum-based plastic, is a reservoir for resistance genes and a potential vector for antibiotic-resistant bacteria in coastal marine sediments. • Bioplastic accumulates antibiotic and metal resistance genes in marine sediments • Four ARG groups and one MRG group were more abundant in bioplastic biofilms • Abundance of ARGs and MRGs in bioplastic biofilms significantly correlated • Bioplastic colonized by B. cereus bacteria resistant to three antibiotic classes",20211215,"Di Cesare, Andrea ; Pinnell, Lee J. ; Brambilla, Diego ; Elli, Giulia ; Sabatino, Raffaella ; Sathicq, María B. ; Corno, Gianluca ; O'Donnell, Colin ; Turner, Jeffrey W.",Abstract,Academic Journal,Dec2021,,Environmental Pollution,Marine sediments ; Coastal sediments ; Antibiotics ; Marine pollution ; Beta lactam antibiotics ; Drug resistance in bacteria ; Microbial sensitivity tests ; Multidrug resistance,ABST,,,0269-7491,,,,,eng,Elsevier B.V.,N.PAG,N.PAG,,291,,10.1016/j.envpol.2021.118161,,JE4,,https://research.ebsco.com/linkprocessor/plink?id=f0bff411-82fc-3c19-8933-89df0721516c
GreenFILE,8gh,182363141,Microplastics mediates the spread of antimicrobial resistance plasmids via modulating conjugal gene expression.,"Antimicrobial resistance (AMR) and environmental degradation are existential global public health threats. Linking microplastics (MPs) and AMR is particularly concerning as MPs pollution would have significant ramifications on controlling of AMR; however, the effects of MPs on the spread and genetic mechanisms of AMR bacteria remain unclear. Herein, we performed Simonsen end-point conjugation to investigate the impact of four commonly used MPs on transfer of clinically relevant plasmids. The transfer breadth of a representative pA/C_MCR-8 plasmid across bacterial communities was confirmed by the cell sorting and 16S rRNA gene amplicon sequencing. Our study shows that exposure to four commonly found MPs promotes the conjugation rates of four clinically relevant AMR plasmids by up to 200-fold, when compared to the non-exposed group and that the transfer rates are MP concentrations demonstrate a positive correlation with higher transfer rates. Furthermore, we show that MPs induce the expression of plasmid-borne conjugal genes and SOS-linked genes such as recA , lexA , dinB and dinD. High-throughput sequencing of the broad transmission of plasmid pA/C_MCR-8, shows distribution over two main phyla, Pseudomonadota (50.0 %-95.0 %) and Bacillota (0.4 %-2.0 %). These findings definitively link two global health emergencies − AMR and environmental degradation via MPs, and to tackle global AMR, we must also now consider plastic utilisation and waste management.",20250101,"Yang, Qiu E. ; Lin, Zhenyan ; Gan, Dehao ; Li, Minchun ; Liu, Xuedan ; Zhou, Shungui ; Walsh, Timothy R.",Article,Academic Journal,Jan2025,true,Environment International,Environmental degradation ; Waste management ; Horizontal gene transfer ; Gene expression ; Drug resistance in microorganisms,JOUR,,,0160-4120,,,,,eng,Elsevier B.V.,N.PAG,N.PAG,,195,,10.1016/j.envint.2025.109261,,JQ0,,https://research.ebsco.com/linkprocessor/plink?id=8d9dce40-ae41-3595-a65e-a7cadd1def84
GreenFILE,8gh,161415372,Detection of faecal bacteria and antibiotic resistance genes in biofilms attached to plastics from human-impacted coastal areas.,"Plastics have been proposed as vectors of bacteria as they act as a substrate for biofilms. In this study, we evaluated the abundance of faecal and marine bacteria and antibiotic resistance genes (ARGs) from biofilms adhered to marine plastics. Floating plastics and plastics from sediments were collected in coastal areas impacted by human faecal pollution in the northwestern Mediterranean Sea. Culture and/or molecular methods were used to quantify faecal indicators (E. coli , Enterococci and crAssphage), and the ARGs sul I, tet W and bla TEM and the 16S rRNA were detected by qPCR assays. Pseudomonas and Vibrio species and heterotrophic marine bacteria were also analysed via culture-based methods. Results showed that, plastic particles covered by bacterial biofilms, primarily consisted of marine bacteria including Vibrio spp. Some floating plastics had a low concentration of viable E. coli and Enterococci (42% and 67% of the plastics respectively). Considering the median area of the plastics, we detected an average of 68 cfu E. coli per item, while a higher concentration of E. coli was detected on individual plastic items, when compared with 100 ml of the surrounding water. Using qPCR, we quantified higher values of faecal indicators which included inactive and dead microorganisms, detecting up to 2.6 × 10<sup>2</sup> gc mm<sup>−2</sup>. The ARGs were detected in 67–88% of the floating plastics and in 29–57% of the sediment plastics with a concentration of up to 6.7 × 10<sup>2</sup> gc mm<sup>−2</sup>. Furthermore, enrichment of these genes was observed in biofilms compared with the surrounding water. These results show that floating plastics act as a conduit for both the attachment and transport of faecal microorganisms. In contrast, low presence of faecal indicators was detected in plastic from seafloor sediments. Therefore, although in low concentrations, faecal bacteria, and potential pathogens, were identified in marine plastics, further suggesting plastics act as a reservoir of pathogens and ARGs. [Display omitted] • From 4.9x10⁴ to 8.7x10⁶ 16S rRNA gene gc mm<sup>-2</sup> were detected on plastics. • An average sized plastic item held from 9.1x10¹ to 1.1x10<sup>4</sup> cfu Vibrio spp. • Faecal indicators were detected in plastics in faecally polluted areas. • Higher concentration of E. coli was detected in a single plastic than in the water. • Marine plastics were colonised by faecal bacteria and drifted to cleaner areas. • There was an enrichment of faecal indicators and ARGs in the plastic biofilm.",20230215,"Liang, Hongxia ; de Haan, William P. ; Cerdà-Domènech, Marc ; Méndez, Javier ; Lucena, Francisco ; García-Aljaro, Cristina ; Sanchez-Vidal, Anna ; Ballesté, Elisenda",Article,Academic Journal,Feb2023,true,Environmental Pollution,Escherichia coli ; Plastics ; Drug resistance in bacteria ; Biofilms ; Heterotrophic bacteria ; Marine bacteria,JOUR,,,0269-7491,,,,,eng,Elsevier B.V.,N.PAG,N.PAG,,319,,10.1016/j.envpol.2022.120983,,JE4,,https://research.ebsco.com/linkprocessor/plink?id=5b6701dd-914b-3a8e-8fc8-23f8e8d88191
GreenFILE,8gh,178732343,The stress response of tetracycline resistance genes and bacterial communities under the existence of microplastics in typical leachate biological treatment system.,"Landfill leachate is an important source of microplastics (MPs) and antibiotic-resistance genes (ARGs). Here, in the presence of polystyrene MPs (PS-MPs) and polyethylene MPs (PE-MPs), the nitrogen and phosphorus removal effect and sludge structure performance were affected in an anaerobic–anoxic–aerobic system, a typical biological leachate treatment process. The abundance of tetracycline-resistance genes (tet genes) in biofilms on the two types of MP was significantly higher than that in the leachate and sludge, and the load on PE-MPs was higher than that on PS-MPs because of the porous structure of PE-MPs. Aging of the MPs increased their surface roughness and abundance of oxygen-containing functional groups and shaped the profile of ARGs in the MP biofilms. The biofilm biomass and growth rate on the two types of MP increased with the incubation time in the first 30 days, and was affected by environmental factors. Structural equation models and co-occurrence network analysis demonstrated that the MPs indirectly affected the spectrum of ARGs by affecting biofilm formation, and, to a lesser extent, had a direct impact on the selective enrichment of ARGs. We discuss the mechanisms of the relationships between MPs and ARGs in the leachate treatment system, which will have guiding significance for future research. Our data on the colonization of microorganisms and tet genes in MPs biofilms provide new evidence concerning the accumulation and transmission of these ARGs, and are important for understanding the mechanisms of MPs in spreading pollution. [Display omitted] • The tet genes was enriched on the MPs biofilm and it boosted in leachate and sludge. • The aging of MPs shaped the profile of ARGs and ARB on MPs biofilm. • MPs reduced the richness and diversity of microbial community in A/A/O. • MPs integrated regulatory environmental factors to assemble ARGs and ARB. • Enhanced biochemical resistance and pathogens aggravated the MPs pollution.",20240815,"Li, Hong ; Lian, Yiting ; Li, Siyi ; Yang, Mingdi ; Xie, Qiaona ; Qiu, Libo ; Liu, Hongyuan ; Long, Yuyang ; Hu, Lifang ; Fang, Chengran",Article,Academic Journal,Aug2024,true,Journal of Environmental Management,Phosphate removal (Sewage purification) ; Emerging contaminants ; Nitrogen removal (Sewage purification) ; Biological systems ; Structural equation modeling,JOUR,,,0301-4797,,,,,eng,Academic Press Inc.,N.PAG,N.PAG,,366,,10.1016/j.jenvman.2024.121865,,EMJ,,https://research.ebsco.com/linkprocessor/plink?id=da53c565-022b-306c-aaae-316140d6a351
GreenFILE,8gh,173725787,"Effects of polyvinylchloride microplastics on the toxicity of nanoparticles and antibiotics to aerobic granular sludge: Nitrogen removal, microbial community and resistance genes.","Copper oxide nanoparticles (CuO NPs) and ciprofloxacin (CIP) have ecological risk to humans and ecosystems. Polyvinylchloride microplastics (PVC MPs), as a representative of microplastics, may often coexist with CuO NPs and CIP in wastewater treatment systems due to their widespread application. However, the co-impact of PVC MPs in wastewater systems contained with CuO NPs and CIP on nitrogen removal and ecological risk is not clear. In this work, PVC MPs co-impacts on the toxicity of CuO NPs and CIP to aerobic granular sludge (AGS) systems and potential mechanisms were investigated. 10 mg/L PVC MPs co-addition did not significantly affect the nitrogen removal, but it definitely changed the microbial community structure and enhanced the propagation and horizontal transfer of antibiotics resistance genes (ARGs). 100 mg/L PVC MPs co-addition resulted in a raise of CuO NP toxicity to the AGS system, but reduced the co-toxicity of CuO NPs and CIP and ARGs expression. The co-impacts with different PVC MPs concentration influenced Cu<sup>2+</sup> concentrations, cell membrane integrity, extracellular polymeric substances (EPS) contents and microbial communities in AGS systems, and lead to a change of nitrogen removal. [Display omitted] • 10 mg/L PVC MPs had no significant effect on the nitrogen removal. • 100 mg/L PVC MPs decreased nitrogen removal efficiency under CuO NPs stress. • 100 mg/L PVC MPs mitigated the co-toxicity of CuO NPs and CIP to AGS. • ARGs expression was enhanced by 10 mg/L PVC MPs, but decreased by 100 mg/L PVC MPs.",20231201,"Li, Yu-Qi ; Zhao, Bai-Hang ; Zhang, Yu-Qing ; Zhang, Xin-Yue ; Chen, Xiao-Tang ; Yang, Hai-Shan",Article,Academic Journal,Dec2023:Part 1,true,Environmental Research,Polyvinyl chloride ; Microbial communities ; Plastic marine debris ; Wastewater treatment ; Nitrogen ; Microplastics ; Copper oxide ; Drug resistance in bacteria,JOUR,,,0013-9351,,,,,eng,Academic Press Inc.,N.PAG,N.PAG,,238,,10.1016/j.envres.2023.117151,,KZQ,,https://research.ebsco.com/linkprocessor/plink?id=129a1b84-7315-3e38-b024-2fffe0ac391e
GreenFILE,8gh,175848560,Selective enrichment of bacteria and antibiotic resistance genes in microplastic biofilms and their potential hazards in coral reef ecosystems.,"Microplastics become hotspots for bacteria to trigger a series of ecological effects, but few studies have focused on the potential impacts of microplastic biofilms in coral reef ecosystems. Here, we measured the bacterial communities and antibiotic resistance genes (ARGs) in the seawater and microplastic biofilms. Results showed that microbial biofilms were formed on the surface of microplastics. The alpha diversity of the bacterial community in the microplastic biofilms was lower than that in the seawater, and the bacterial communities were distinct between the two. Further analysis revealed that several bacteria in the microplastic biofilms carried ARGs, and the proportion of which was correlated to the concentration of antibiotics in the seawater. Specifically, Vibrio was positively correlated to sul1 in the microplastic biofilms under higher concentrations of sulfonamides. Pathway analysis reflected significant overrepresentation of human disease related pathways in the bacterial community of microplastic biofilms. These results suggest that the microplastic biofilms could selectively enrich bacteria from the reef environments, causing the development of ARGs under antibiotic driving. This may pose a serious threat to coral reef ecosystems and human health. Our study provides new insights into the ecological impacts of microplastic biofilms in coral reef ecosystems. [Display omitted] • Microplastics could selectively enrich bacteria from seawater in coral reef regions. • Bacteria on microplastics carried ARGs under antibiotic driving. • Microplastics pose a potential threat to coral and human health via pathogens and ARGs.",20240315,"Zhou, Zhi ; Tang, Jia ; Tang, Kai ; An, Mingxun ; Liu, Zhaoqun ; Wu, Zhongjie ; Cao, Xiaocong ; He, Chunlong",Article,Academic Journal,Mar2024,true,Chemosphere,Coral reefs & islands ; Corals ; Ecological impact ; Ecosystems ; Biofilms ; Drug resistance in bacteria,JOUR,,,0045-6535,,,,,eng,Elsevier B.V.,N.PAG,N.PAG,,352,,10.1016/j.chemosphere.2024.141309,,JQF,,https://research.ebsco.com/linkprocessor/plink?id=0b024bb7-9610-38a2-8a6d-9b1caf1387a6
GreenFILE,8gh,178233566,Effects of triclosan adsorption on intestinal toxicity and resistance gene expression in Xenopus tropicalis with different particle sizes of polystyrene.,"Microplastics (MPs) are commonly found with hydrophobic contaminants in the water column and pose a serious threat to aquatic organisms. The effects of polystyrene microplastics of different particle sizes on the accumulation of triclosan in the gut of Xenopus tropicalis , its toxic effects, and the transmission of resistance genes were evaluated. The results showed that co-exposure to polystyrene (PS-MPs) adsorbed with triclosan (TCS) caused the accumulation of triclosan in the intestine with the following accumulation capacity: TCS + 5 µm PS group > TCS group > TCS + 20 µm PS group > TCS + 0.1 µm PS group. All experimental groups showed increased intestinal inflammation and antioxidant enzyme activity after 28 days of exposure to PS-MPs and TCS of different particle sizes. The TCS + 20 µm PS group exhibited the highest upregulated expression of pro-inflammatory factors (IL- 10, IL -1β). The TCS + 20 µm group showed the highest increase in enzyme activity compared to the control group. PS-MPs and TCS, either alone or together, altered the composition of the intestinal microbial community. In addition, the presence of more antibiotic resistance genes than triclosan resistance genes significantly increased the expression of tetracycline resistance and sulfonamide resistance genes, which may be associated with the development of intestinal inflammation and oxidative stress. This study refines the aquatic ecotoxicity assessment of TCS adsorbed by MPs and provides informative information for the management and control of microplastics and non-antibiotic bacterial inhibitors. [Display omitted]",20241201,"Dai, Zhuo ; Wang, Zikai ; Pan, Xinying ; Zheng, Li ; Xu, Yanbin ; Qiao, Qingxia",Article,Academic Journal,Dec2024,true,Journal of Environmental Sciences (Elsevier),Poisons ; Polystyrene ; Triclosan ; Gene expression ; Xenopus ; Intestines,JOUR,,,1001-0742,,,,,eng,Elsevier B.V.,185,176,10,146,,10.1016/j.jes.2023.06.036,,639I,,https://research.ebsco.com/linkprocessor/plink?id=cc606572-e187-3d71-9e59-b9e9f99b53ce
